{
  "slug": "story-letter-bird",
  "title": "نامه‌ای که پرنده شد",
  "intent": "نامه‌ای با خطی روان نوشته می‌شود؛ حرف آخرش بلند می‌شود، کاغذ تا می‌شود و نامه پرنده‌ای می‌شود که از پنجره پرواز می‌کند و کلمه «پیام» را با خود می‌برد.",
  "audience": "general short-form viewers (internal story lab)",
  "language": "fa",
  "ratios": [
    "9x16",
    "16x9"
  ],
  "duration_s": 22,
  "tone": "gentle, poetic; tempo 70-80, lyrical",
  "must_have": [
    "Persian copy only, original, neutral",
    "all assets drawn as SVG or kit sound; no photos",
    "protagonist: a Persian word on a folded letter that becomes a bird",
    "3-4 payoff moments with anticipation->hit->ring->tail"
  ],
  "must_not": [
    "no real organisations, brands or people",
    "no secrets or client names"
  ],
  "confidential": false,
  "owner_approved": false
}
