{
  "slug": "story-endless-clock",
  "title": "ساعتی که به صفر نمی‌رسد",
  "intent": "شمارش معکوس از ده شروع می‌شود، هر بار به یک می‌رسد و دوباره از ده برمی‌گردد؛ اما هر دور آرام‌تر می‌شود، تا جمله آخر معنی تازه‌ای پیدا کند: «هنوز وقت هست».",
  "audience": "general short-form viewers (internal story lab)",
  "language": "fa",
  "ratios": [
    "9x16",
    "1x1"
  ],
  "duration_s": 14,
  "tone": "wry, rhythmic; tempo 100-110, ticking",
  "must_have": [
    "Persian copy only, original, neutral",
    "all assets drawn as SVG or kit sound; no photos",
    "protagonist: a big Persian-digit countdown inside a circle ring",
    "3-4 payoff moments with anticipation->hit->ring->tail"
  ],
  "must_not": [
    "no real organisations, brands or people",
    "no secrets or client names"
  ],
  "confidential": false,
  "owner_approved": false
}
